{
  "schema_version": "mutation-adapter.v1",
  "adapter_id": "testgen-semantic-only",
  "runner_path": ".testgen/mutation-runner.cjs",
  "mutations": [
    {
      "mutation_id": "skip-order-insert",
      "criterion_id": "order-appears-in-table",
      "affected_paths": ["public/app.js"],
      "patch_path": ".testgen/mutations/skip-order-insert.patch",
      "definition_digest": "82d86c07bb8337c6e17ec6859b2f2a7be9cc491435feab543d0c91217fdd76c2",
      "timeout_ms": 120000
    }
  ]
}
